{
    "$schema": "http://json-schema.org/draft-04/schema#",
    "type": "object",
    "properties": {
      "name": {
        "type": "string"
      },
      "width": {
        "type": "integer"
      },
      "height": {
        "type": "integer"
      },
      "paths": {
        "type": "array",
        "items": [
          {
            "type": "object",
            "properties": {
              "x": {
                "type": "integer"
              },
              "y": {
                "type": "integer"
              },
              "isStart": {
                "type": "boolean"
              }
            },
            "required": [
              "x",
              "y",
              "isStart"
            ]
          },
          {
            "type": "object",
            "properties": {
              "x": {
                "type": "integer"
              },
              "y": {
                "type": "integer"
              }
            },
            "required": [
              "x",
              "y"
            ]
          },
          {
            "type": "object",
            "properties": {
              "x": {
                "type": "integer"
              },
              "y": {
                "type": "integer"
              }
            },
            "required": [
              "x",
              "y"
            ]
          },
          {
            "type": "object",
            "properties": {
              "x": {
                "type": "integer"
              },
              "y": {
                "type": "integer"
              }
            },
            "required": [
              "x",
              "y"
            ]
          },
          {
            "type": "object",
            "properties": {
              "x": {
                "type": "integer"
              },
              "y": {
                "type": "integer"
              }
            },
            "required": [
              "x",
              "y"
            ]
          },
          {
            "type": "object",
            "properties": {
              "x": {
                "type": "integer"
              },
              "y": {
                "type": "integer"
              }
            },
            "required": [
              "x",
              "y"
            ]
          },
          {
            "type": "object",
            "properties": {
              "x": {
                "type": "integer"
              },
              "y": {
                "type": "integer"
              }
            },
            "required": [
              "x",
              "y"
            ]
          },
          {
            "type": "object",
            "properties": {
              "x": {
                "type": "integer"
              },
              "y": {
                "type": "integer"
              },
              "isFinish": {
                "type": "boolean"
              }
            },
            "required": [
              "x",
              "y",
              "isFinish"
            ]
          }
        ]
      }
    },
    "required": [
      "name",
      "width",
      "height",
      "paths"
    ]
  }