{
    "name": "a test map",
    "width": 10,
    "height": 10,
    "paths": [
        { "x": 1, "y": 0, "isStart": true },
        { "x": 2, "y": 0 },
        { "x": 2, "y": 1 },
        { "x": 2, "y": 2 },
        { "x": 2, "y": 3 },
        { "x": 3, "y": 3 },
        { "x": 4, "y": 3 },
        { "x": 5, "y": 3, "isFinish": true }
    ]
}